{"$schema":"https://intentius.io/chant/schemas/workspace/change-set/v1/change-set.schema.json","contract":1,"digest":"jcs1-sha256:8bea92bbec7c5d0ae237cf3c04325c2e4ef61b4c30fe21b5ffcb361173e14592","entries":[],"graph":null,"members":[{"holes":[],"lexicon":"terraform","member":"app","planDigest":"jcs1-sha256:0ec0094db6768cbc09c8222ea4ac357a83ea4a0cf2872057704e61bbb376e596","planner":"tofu","status":"planned"},{"holes":[],"lexicon":"terraform","member":"net","planDigest":"jcs1-sha256:551801115e331f9bf61754b84613851941b85a788e3d3b4b3ad505019fe1696b","planner":"tofu","status":"planned"}],"summary":{"actions":{"create":0,"delete":0,"forget":0,"no-op":0,"read":0,"replace":0,"update":0},"byMember":{},"deletes":[],"entries":0,"failed":[],"holes":0,"members":2,"replacements":[],"types":{}}}
